{
  "schema": "agent_implementation_packet.v1",
  "schema_version": 1,
  "packet_id": "example-train/P_service_marker_probe/2026-08-24T06:00:00Z",
  "repository": {
    "name": "perl-lsp-swarm",
    "observed_tree": "a277266c5"
  },
  "programme": {
    "name": "example-train",
    "manifest": "example_train.v1",
    "manifest_version": "3"
  },
  "work": {
    "owning_issue": "#10858",
    "node_id": "N_service_marker_probe",
    "proposition_id": "P_service_marker_probe",
    "profile": "coding_agent_bounded",
    "profile_conditional": false,
    "node_kind": "bounded_implementation_leaf",
    "result_sentence": "The service-marker probe emits one typed mismatch finding per stale marker with a focused failing-first test.",
    "claim_ceiling": "Establishes only the service-marker probe and its focused test; no frontier, scheduler, packet-selection, or live-observation semantics.",
    "unproven": [
      "end-to-end marker freshness across multiple programmes"
    ],
    "non_goals": [
      "no readiness evaluation",
      "no GitHub observation"
    ],
    "successors": [
      "P_service_marker_rollout"
    ]
  },
  "actor": {
    "role": "coding_agent_bounded",
    "write_boundary": "repository_candidate_branch"
  },
  "frontier": {
    "decision": "ready",
    "digest": "frontier:example-train:3:ready:P_service_marker_probe:sha256:1c0f",
    "blocking_edges": []
  },
  "current_tree_probe": {
    "subject": "xtask/src/tasks/service_marker_probe.rs",
    "result": "branch-candidate-open",
    "digest": "probe:xtask/src/tasks/service_marker_probe.rs:a277266c5:open"
  },
  "live_observation": {
    "candidate_state": "observed",
    "digest": "live:example-train:P_service_marker_probe:pr-12150",
    "candidate_identity": "PR #12150 branch tooling/service-marker-probe head 44d2c9e10",
    "collision_state": "one-writer-active-no-collision"
  },
  "authorities": {
    "must_be_current": [
      {
        "ref": "#10858",
        "subject": "shared train edge and claim-profile contract",
        "proof_kind": "current_tree_probe",
        "proof_tree": "a277266c5"
      }
    ],
    "may_be_mined": [
      {
        "ref": "refs/heads/archived/marker-spike",
        "subject": "historical marker-spike branch",
        "proof_kind": "historical_branch",
        "proof_tree": "6f04e1ab2"
      }
    ],
    "must_not_be_reimplemented": [
      {
        "ref": "xtask/src/tasks/train_edge_contract.rs",
        "subject": "shared edge-contract validator",
        "proof_kind": "current_tree_probe",
        "proof_tree": "a277266c5"
      }
    ],
    "consumer_fan_in": [
      {
        "ref": "#10872",
        "subject": "shared builder-packet contract consumer",
        "proof_kind": "external_owner_note"
      }
    ],
    "external_manual_owner": [
      {
        "ref": "maintainer/merger",
        "subject": "review and merge authority",
        "proof_kind": "external_owner_note"
      }
    ]
  },
  "surfaces": {
    "implementation_paths": [
      "xtask/src/tasks/service_marker_probe.rs"
    ],
    "tests_fixtures": [
      "fixtures/service_marker_probe/stale_marker.v1.json"
    ],
    "generated_artifacts": [],
    "docs_fragments": [],
    "writer_slots": [
      {
        "key": "service-marker-probe-module",
        "paths": [
          "xtask/src/tasks/service_marker_probe.rs"
        ]
      }
    ],
    "forbidden_adjacent": [
      "xtask/src/tasks/train_edge_contract.rs"
    ]
  },
  "proof": {
    "falsifiers": [
      {
        "id": "F_candidate_resume_repairs_probe",
        "stage": "integration",
        "statement": "Resuming PR #12150 must repair the probe so the stale-marker focused test passes; discarding the observed candidate and rewriting from scratch is a defect."
      },
      {
        "id": "F_marker_missing_fails",
        "stage": "unit",
        "statement": "A stale service marker that the probe accepts is a defect: the focused test feeds one stale marker and asserts the typed mismatch is emitted."
      }
    ],
    "positive_discriminator": "The probe distinguishes a stale marker from a fresh one by comparing the marker's recorded tree against the observed tree, not by marker presence alone.",
    "mutation_controls": [
      "Inverting the tree comparison in the probe must flip both focused tests red."
    ],
    "terminal_outcomes": [
      "DELIVERED_REVIEWABLE_PR",
      "RESUMED_CANDIDATE",
      "NOT_PROVEN"
    ]
  },
  "verification": {
    "steps": [
      {
        "command_id": "xtask.test.service_marker_probe",
        "command": "cargo test -p xtask --bin xtask service_marker_probe --locked",
        "scope": "focused_proof"
      },
      {
        "command_id": "git.diff_check",
        "command": "git diff --check",
        "scope": "diff_check"
      }
    ]
  },
  "delivery": {
    "definition": "reviewable_draft_pr_and_handoff",
    "branch_suggestion": "tooling/example-service-marker-probe",
    "pr_title_suggestion": "tooling(train): add the service-marker probe focused falsifier",
    "pr_body_fields": [
      "change",
      "proof",
      "candidate-resume"
    ],
    "old_path_disposition": "reused",
    "limitations": [
      "candidate observation is a snapshot; re-observe before acting"
    ],
    "remaining_blocker_or_next": "repair the observed candidate and hand the PR back to review"
  },
  "stop": {
    "conditions": [
      "stop at the reviewable draft PR and handoff comment",
      "do not merge or release",
      "re-observe the candidate if resumption is delayed"
    ],
    "permitted_terminal_actions": []
  },
  "metadata": {
    "observed_at": "2026-08-24T06:00:00Z"
  }
}
