{"actor":{"role":"coding_agent_bounded","write_boundary":"repository_candidate_branch"},"authorities":{"consumer_fan_in":[{"proof_kind":"external_owner_note","ref":"#10872","subject":"shared builder-packet contract consumer"}],"external_manual_owner":[{"proof_kind":"external_owner_note","ref":"maintainer/reviewer","subject":"review and merge authority"}],"may_be_mined":[{"proof_kind":"historical_branch","proof_tree":"6f04e1ab2","ref":"refs/heads/archived/marker-spike","subject":"historical marker-spike branch"}],"must_be_current":[{"proof_kind":"current_tree_probe","proof_tree":"a277266c5","ref":"#10858","subject":"shared train edge and claim-profile contract"},{"proof_kind":"spec_disposition","ref":".spec/10858-train-edge-contract/acceptance.md","subject":"checked acceptance criteria for the shared edge contract"}],"must_not_be_reimplemented":[{"proof_kind":"current_tree_probe","proof_tree":"a277266c5","ref":"xtask/src/tasks/train_edge_contract.rs","subject":"shared edge-contract validator"}]},"current_tree_probe":{"digest":"probe:xtask/src/tasks/service_marker_probe.rs:a277266c5:absent","result":"absent-on-observed-tree","subject":"xtask/src/tasks/service_marker_probe.rs"},"delivery":{"branch_suggestion":"tooling/example-service-marker-probe","definition":"reviewable_draft_pr_and_handoff","limitations":["probe covers one programme's marker namespace"],"old_path_disposition":"none","pr_body_fields":["boundaries","change","proof","rollback"],"pr_title_suggestion":"tooling(train): add the service-marker probe focused falsifier","remaining_blocker_or_next":"after merge, P_service_marker_rollout may compose over this probe"},"frontier":{"blocking_edges":[],"decision":"ready","digest":"frontier:example-train:3:ready:P_service_marker_probe:sha256:1c0f"},"live_observation":{"candidate_state":"not_observed","digest":"live:example-train:P_service_marker_probe:not_observed"},"packet_id":"example-train/P_service_marker_probe/2026-08-24T00:00:00Z","programme":{"manifest":"example_train.v1","manifest_version":"3","name":"example-train"},"proof":{"cleanup_retention":"No temporary files are retained; fixtures live under fixtures/service_marker_probe/ and are covered by the allowlist.","falsifiers":[{"id":"F_fresh_marker_passes","stage":"unit","statement":"A fresh marker must not emit a finding; the positive control feeds a current marker and asserts no mismatch."},{"id":"F_marker_missing_fails","stage":"unit","statement":"A stale service marker that the probe accepts is a defect: the focused test feeds one stale marker and asserts the typed mismatch is emitted."}],"mutation_controls":["Deleting the emission path must fail the stale-marker falsifier.","Inverting the tree comparison in the probe must flip both focused tests red."],"positive_discriminator":"The probe distinguishes a stale marker from a fresh one by comparing the marker's recorded tree against the observed tree, not by marker presence alone.","terminal_outcomes":["BLOCKED_MISSING_INPUT","DELIVERED_REVIEWABLE_PR","NOT_PROVEN"]},"repository":{"name":"perl-lsp-swarm","observed_tree":"a277266c5"},"schema":"agent_implementation_packet.v1","schema_version":1,"stop":{"conditions":["do not merge, release, or perform any external action","do not mutate the programme manifest or frontier","stop at the reviewable draft PR and handoff comment"],"permitted_terminal_actions":[]},"surfaces":{"docs_fragments":[],"forbidden_adjacent":["schemas/train_edge_contract.v1.schema.json","xtask/src/tasks/train_edge_contract.rs"],"generated_artifacts":["docs/policy/NON_RUST_INVENTORY.md"],"implementation_paths":["xtask/src/tasks/service_marker_probe.rs"],"tests_fixtures":["fixtures/service_marker_probe/stale_marker.v1.json"],"writer_slots":[{"key":"service-marker-fixture","paths":["fixtures/service_marker_probe/stale_marker.v1.json"]},{"key":"service-marker-probe-module","paths":["xtask/src/tasks/service_marker_probe.rs"]}]},"verification":{"steps":[{"command":"cargo test -p xtask --bin xtask service_marker_probe --locked","command_id":"xtask.test.service_marker_probe","scope":"focused_proof"},{"command":"cargo xtask non-rust inventory --write","command_id":"xtask.non_rust_inventory_write","scope":"generation","second_run_no_diff":true},{"command":"cargo xtask check-file-policy","command_id":"xtask.check_file_policy","scope":"file_policy"},{"command":"cargo fmt -p xtask -- --check","command_id":"cargo.fmt_check","scope":"format"},{"command":"cargo clippy -p xtask --all-targets --locked -- -D warnings","command_id":"cargo.clippy_xtask","scope":"clippy"},{"command":"git diff --check","command_id":"git.diff_check","scope":"diff_check"}]},"work":{"claim_ceiling":"Establishes only the service-marker probe and its focused test; no frontier, scheduler, packet-selection, or live-observation semantics.","node_id":"N_service_marker_probe","node_kind":"bounded_implementation_leaf","non_goals":["no GitHub observation","no readiness evaluation","no scheduler or agent assignment"],"owning_issue":"#10858","profile":"coding_agent_bounded","profile_conditional":false,"proposition_id":"P_service_marker_probe","result_sentence":"The service-marker probe emits one typed mismatch finding per stale marker with a focused failing-first test.","successors":["P_service_marker_rollout"],"unproven":["end-to-end marker freshness across multiple programmes","performance under a ten-thousand-marker workspace"]}}